<?xml version="1.0" encoding="UTF-8"?>
<!DOCTYPE list SYSTEM "item.dtd">
<list>
	<armor id="26326" name="Lineage II Baseball Uniform">
		<set name="sellable" value="false"/>
		<set name="crystal_type" value="NONE"/>
		<set name="icon" value="icon.london_olympic_bikini"/>
		<set name="type" value="HEAVY"/>
		<set name="weight" value="1000"/>
		<equip>
			<slot id="FORMAL_WEAR"/>
		</equip>
	</armor>
	<armor id="26327" name="Lineage II Baseball Cap">
		<set name="sellable" value="false"/>
		<set name="crystal_type" value="NONE"/>
		<set name="icon" value="icon.accessory_mining_cap_i00"/>
		<set name="type" value="NONE"/>
		<set name="weight" value="10"/>
		<equip>
			<slot id="HAIR_ALL"/>
		</equip>
	</armor>
	<etcitem id="26354" name="Gem">
		<set name="sellable" value="false"/>
		<set name="privatestoreable" value="false"/>
		<set name="dropable" value="false"/>
		<set name="tradeable" value="false"/>
		<set name="icon" value="icon.etc_talisman_energy_i01"/>
		<set name="stackable" value="true"/>
		<set name="crystal_type" value="NONE"/>
	</etcitem>
</list>