<?xml version="1.0" encoding="UTF-8"?>
<!DOCTYPE list SYSTEM "item.dtd">
<list>
	<armor id="13752" name="Olympiad Warrior\'s Ring">
		<set name="sellable" value="false"/>
		<set name="privatestoreable" value="false"/>
		<set name="dropable" value="false"/>
		<set name="tradeable" value="false"/>
		<set name="crystal_type" value="A"/>
		<set name="icon" value="icon.accessory_ring_of_hero_i00"/>
		<set name="type" value="NONE"/>
		<set name="weight" value="150"/>
		<equip>
			<slot id="RIGHT_FINGER"/>
			<slot id="LEFT_FINGER"/>
		</equip>
		<for>
			<add stat="mDef" order="0x10" value="42"/>
			<add stat="maxMp" order="0x60" value="21"/>
		</for>
	</armor>
	<armor id="13753" name="Olympiad Warrior\'s Necklace">
		<set name="sellable" value="false"/>
		<set name="privatestoreable" value="false"/>
		<set name="dropable" value="false"/>
		<set name="tradeable" value="false"/>
		<set name="crystal_type" value="A"/>
		<set name="icon" value="icon.accessory_necklace_of_hero_i00"/>
		<set name="type" value="NONE"/>
		<set name="weight" value="150"/>
		<equip>
			<slot id="NECKLACE"/>
		</equip>
		<for>
			<add stat="mDef" order="0x10" value="85"/>
			<add stat="maxMp" order="0x60" value="42"/>
		</for>
	</armor>
	<armor id="13754" name="Olympiad Warrior\'s Earring">
		<set name="sellable" value="false"/>
		<set name="privatestoreable" value="false"/>
		<set name="dropable" value="false"/>
		<set name="tradeable" value="false"/>
		<set name="crystal_type" value="A"/>
		<set name="icon" value="icon.accessory_earring_of_hero_i00"/>
		<set name="type" value="NONE"/>
		<set name="weight" value="150"/>
		<equip>
			<slot id="RIGHT_EAR"/>
			<slot id="LEFT_EAR"/>
		</equip>
		<for>
			<add stat="mDef" order="0x10" value="63"/>
			<add stat="maxMp" order="0x60" value="31"/>
		</for>
	</armor>
</list>