<?xml version="1.0" encoding="UTF-8"?>
<!DOCTYPE list SYSTEM "item.dtd">
<list>
	<armor id="20662" name="Agathion - Uthanka">
		<set name="is_olympiad_can_use" value="false"/>
		<set name="sellable" value="false"/>
		<set name="privatestoreable" value="false"/>
		<set name="freightable" value="true"/>
		<set name="crystal_type" value="NONE"/>
		<set name="dropable" value="false"/>
		<set name="icon" value="BranchSys.icon.br_aga_uthanka_i00"/>
		<set name="tradeable" value="false"/>
		<set name="type" value="NONE"/>
		<set name="weight" value="150"/>
		<equip>
			<slot id="LEFT_BRACELET"/>
		</equip>
		<skills>
			<skill id="3267" level="1"/>
			<skill id="21109" level="1"/>
			<skill id="23087" level="1"/>
		</skills>
	</armor>
	<armor id="20666" name="Valkyrie Hat">
		<set name="is_olympiad_can_use" value="false"/>
		<set name="sellable" value="false"/>
		<set name="dropable" value="false"/>
		<set name="crystal_type" value="NONE"/>
		<set name="icon" value="BranchSys.icon.br_valkyrie_cap_i00"/>
		<set name="type" value="NONE"/>
		<set name="weight" value="10"/>
		<equip>
			<slot id="HAIR_ALL"/>
		</equip>
	</armor>
	<armor id="20678" name="Gatekeeper Hat">
		<set name="is_olympiad_can_use" value="false"/>
		<set name="sellable" value="false"/>
		<set name="dropable" value="false"/>
		<set name="crystal_type" value="NONE"/>
		<set name="icon" value="BranchSys.icon.br_gatekeeper_of_hat_i00"/>
		<set name="type" value="NONE"/>
		<set name="weight" value="10"/>
		<equip>
			<slot id="HAIR_ALL"/>
		</equip>
	</armor>
</list>