<?xml version="1.0" encoding="UTF-8"?>
<!DOCTYPE list SYSTEM "item.dtd">
<list>
	<armor id="13501" name="Refined Romantic Chapeau">
		<set name="sellable" value="false"/>
		<set name="crystal_type" value="NONE"/>
		<set name="icon" value="icon.accessory_archer_hat2_i00"/>
		<set name="type" value="NONE"/>
		<set name="weight" value="10"/>
		<equip>
			<slot id="HAIR_ALL"/>
		</equip>
	</armor>
	<armor id="13519" name="Gran Kain\'s Black Mask &lt;Str+1 Int+1&gt;">
		<set name="sellable" value="false"/>
		<set name="crystal_type" value="NONE"/>
		<set name="icon" value="icon.accessory_jjoro_masj_i00"/>
		<set name="type" value="NONE"/>
		<set name="weight" value="10"/>
		<equip>
			<slot id="HAIR_ALL"/>
		</equip>
		<skills>
			<skill id="39062" level="1"/>
		</skills>
		<for>	<!--TODO: Вынести в скиллы!-->
			<add stat="STR" order="0x10" value="1"/>
			<add stat="INT" order="0x10" value="1"/>
		</for>
	</armor>
	<armor id="13520" name="Event - Jindo Dog Hat">
		<set name="sellable" value="false"/>
		<set name="privatestoreable" value="false"/>
		<set name="dropable" value="false"/>
		<set name="tradeable" value="false"/>
		<set name="crystal_type" value="NONE"/>
		<set name="icon" value="icon.accessory_jindo_cap_i00"/>
		<set name="type" value="NONE"/>
		<set name="weight" value="10"/>
		<equip>
			<slot id="HAIR_ALL"/>
		</equip>
	</armor>
	<armor id="13521" name="Event - Shaggy Dog Hat">
		<set name="sellable" value="false"/>
		<set name="privatestoreable" value="false"/>
		<set name="dropable" value="false"/>
		<set name="tradeable" value="false"/>
		<set name="crystal_type" value="NONE"/>
		<set name="icon" value="icon.accessory_sapsal_cap_i00"/>
		<set name="type" value="NONE"/>
		<set name="weight" value="10"/>
		<equip>
			<slot id="HAIR_ALL"/>
		</equip>
	</armor>
</list>