<?xml version="1.0" encoding="UTF-8"?>
<!DOCTYPE list SYSTEM "item.dtd">
<list>
	<armor id="21162" name="Wedding Veil">
		<set name="is_olympiad_can_use" value="false"/>
		<set name="sellable" value="false"/>
		<set name="dropable" value="false"/>
		<set name="crystal_type" value="NONE"/>
		<set name="icon" value="BranchSys2.icon.br_wedding_vail_i00"/>
		<set name="type" value="NONE"/>
		<set name="weight" value="10"/>
		<equip>
			<slot id="HAIR_ALL"/>
		</equip>
	</armor>
	<weapon id="21163" name="Wedding Bouquet">
		<set name="sellable" value="false"/>
		<set name="dropable" value="false"/>
		<set name="crystal_type" value="NONE"/>
		<set name="icon" value="BranchSys2.icon.br_wedding_bouquet_i00"/>
		<set name="type" value="ETC"/>
		<set name="weight" value="1600"/>
		<set name="soulshots" value="1"/>
		<set name="spiritshots" value="1"/>
		<set name="rnd_dam" value="1"/>
		<equip>
			<slot id="RIGHT_HAND"/>
		</equip>
		<for>
			<add stat="pAtk" order="0x10" value="1"/>
			<add stat="mAtk" order="0x10" value="1"/>
			<set stat="basePAtkSpd" order="0x08" value="379"/>
			<set stat="basePCritRate" order="0x08" value="10"/>
		</for>
	</weapon>
	<armor id="21165" name="Agathion - Zaken\'s Spirit Swords">
		<set name="is_olympiad_can_use" value="false"/>
		<set name="sellable" value="false"/>
		<set name="crystal_type" value="NONE"/>
		<set name="icon" value="BranchSys2.Icon.br_aga_zaken_i00"/>
		<set name="type" value="NONE"/>
		<set name="weight" value="150"/>
		<equip>
			<slot id="LEFT_BRACELET"/>
		</equip>
		<skills>
			<skill id="55417" level="1"/>
			<skill id="55441" level="1"/>
			<skill id="3267" level="1"/>
		</skills>
	</armor>
</list>