<?xml version="1.0" encoding="UTF-8"?>
<!DOCTYPE list SYSTEM "item.dtd">
<list>
	<etcitem id="91000" name="Rush\'s Supplies - Baium">
		<set name="sellable" value="false"/>
		<set name="privatestoreable" value="false"/>
		<set name="dropable" value="false"/>
		<set name="tradeable" value="false"/>
		<set name="icon" value="icon.bm_pirate_treasure_box"/>
		<set name="stackable" value="true"/>
		<set name="crystal_type" value="NONE"/>
		<set name="handler" value="SkillsReduce"/>
		<skills>
			<skill id="51067" level="1"/>	<!--Rush's Supplies - Баюм-->
		</skills>
	</etcitem>
	<etcitem id="91001" name="Box with 3 Jewels Lv. 3">
		<set name="sellable" value="false"/>
		<set name="privatestoreable" value="false"/>
		<set name="dropable" value="false"/>
		<set name="tradeable" value="false"/>
		<set name="icon" value="icon.etc_bm_jewelbox_shhadai"/>
		<set name="stackable" value="true"/>
		<set name="crystal_type" value="NONE"/>
	</etcitem>
	<etcitem id="91002" name="Box with 5 Jewels Lv. 4">
		<set name="sellable" value="false"/>
		<set name="privatestoreable" value="false"/>
		<set name="dropable" value="false"/>
		<set name="tradeable" value="false"/>
		<set name="icon" value="icon.etc_bm_jewelbox_shhadai"/>
		<set name="stackable" value="true"/>
		<set name="crystal_type" value="NONE"/>
	</etcitem>
	<armor id="91003" name="Agathion Bracelet - Lv. 1" add_name="1-day">
		<set name="sellable" value="false"/>
		<set name="privatestoreable" value="false"/>
		<set name="dropable" value="false"/>
		<set name="tradeable" value="false"/>
		<set name="crystal_type" value="NONE"/>
		<set name="icon" value="icon.agathion_magmeld_teleport"/>
		<set name="type" value="NONE"/>
		<set name="weight" value="100"/>
		<equip>
			<slot id="LEFT_BRACELET"/>
		</equip>
		<skills>
			<skill id="51025" level="1"/>	<!--Expand Primary and Secondary Agathion Slots-->
		</skills>
	</armor>
	<armor id="91004" name="Agathion - Sin Eater">
		<set name="sellable" value="false"/>
		<set name="privatestoreable" value="false"/>
		<set name="destroyable" value="false"/>
		<set name="dropable" value="false"/>
		<set name="tradeable" value="false"/>
		<set name="crystal_type" value="NONE"/>
		<set name="icon" value="icon.etc_leash_i00"/>
		<set name="type" value="NONE"/>
		<set name="weight" value="50"/>
		<equip>
			<slot id="AGATHION"/>
		</equip>
		<agathion_data>
			<enchant level="0">
				<main_skills>
					<skill id="51068" level="1"/><!--Summon Sin Eater Agathion-->
				</main_skills>
			</enchant>
		</agathion_data>
	</armor>
	<etcitem id="91005" name="Crumbs of Penitence">
		<set name="sellable" value="false"/>
		<set name="privatestoreable" value="false"/>
		<set name="dropable" value="false"/>
		<set name="tradeable" value="false"/>
		<set name="icon" value="icon.etc_powder_white_i00"/>
		<set name="stackable" value="true"/>
		<set name="crystal_type" value="NONE"/>
		<set name="type" value="QUEST"/>
	</etcitem>
	<armor id="91006" name="Damaged Zaken\'s Earring">
		<set name="sellable" value="false"/>
		<set name="crystal_type" value="NONE"/>
		<set name="icon" value="icon.accessory_earring_of_zaken_i00"/>
		<set name="type" value="NONE"/>
		<set name="weight" value="150"/>
		<equip>
			<slot id="RIGHT_EAR"/>
			<slot id="LEFT_EAR"/>
		</equip>
		<for>
			<add stat="mDef" order="0x10" value="50"/>
		</for>
	</armor>
	<etcitem id="91007" name="Rush\'s Supplies - Zaken">
		<set name="sellable" value="false"/>
		<set name="privatestoreable" value="false"/>
		<set name="dropable" value="false"/>
		<set name="tradeable" value="false"/>
		<set name="icon" value="icon.bm_pirate_treasure_box"/>
		<set name="stackable" value="true"/>
		<set name="crystal_type" value="NONE"/>
		<set name="handler" value="SkillsReduce"/>
		<skills>
			<skill id="51078" level="1"/>	<!--Rush's Supplies - Zaken -->
		</skills>
	</etcitem>
	<etcitem id="91008" name="Dragon\'s Relic Chest">
		<set name="sellable" value="false"/>
		<set name="dropable" value="false"/>
		<set name="icon" value="icon.card_event_blue_box"/>
		<set name="stackable" value="true"/>
		<set name="crystal_type" value="NONE"/>
	</etcitem>
	<etcitem id="91009" name="Fire Dragon\'s Relic Chest">
		<set name="sellable" value="false"/>
		<set name="dropable" value="false"/>
		<set name="icon" value="icon.card_event_red_box"/>
		<set name="stackable" value="true"/>
		<set name="crystal_type" value="NONE"/>
	</etcitem>
	<etcitem id="91010" name="Land Dragon\'s Relic Chest">
		<set name="sellable" value="false"/>
		<set name="dropable" value="false"/>
		<set name="icon" value="icon.card_event_black_box"/>
		<set name="stackable" value="true"/>
		<set name="crystal_type" value="NONE"/>
	</etcitem>
	<etcitem id="91011" name="Dragon\'s Dye Box" add_name="3rd Class Transfer">
		<set name="sellable" value="false"/>
		<set name="dropable" value="false"/>
		<set name="icon" value="icon.card_event_gold_box"/>
		<set name="stackable" value="true"/>
		<set name="crystal_type" value="NONE"/>
	</etcitem>
	<etcitem id="91012" name="Weapon Supply Box (Best A-grade)">
		<set name="sellable" value="false"/>
		<set name="dropable" value="false"/>
		<set name="icon" value="icon.etc_treasure_box_i00"/>
		<set name="stackable" value="true"/>
		<set name="crystal_type" value="NONE"/>
	</etcitem>
	<etcitem id="91013" name="Weapon Ingredient/Recipe Box (Top A-grade)">
		<set name="sellable" value="false"/>
		<set name="dropable" value="false"/>
		<set name="icon" value="icon.etc_treasure_box_i00"/>
		<set name="stackable" value="true"/>
		<set name="crystal_type" value="NONE"/>
	</etcitem>
	<etcitem id="91014" name="Weapon Recipe Box (Best A-grade)">
		<set name="sellable" value="false"/>
		<set name="dropable" value="false"/>
		<set name="icon" value="icon.etc_treasure_box_i00"/>
		<set name="stackable" value="true"/>
		<set name="crystal_type" value="NONE"/>
	</etcitem>
	<etcitem id="91015" name="Sirra\'s Blade Ingredient/Recipe Box">
		<set name="sellable" value="false"/>
		<set name="dropable" value="false"/>
		<set name="icon" value="icon.etc_treasure_box_i04"/>
		<set name="stackable" value="true"/>
		<set name="crystal_type" value="NONE"/>
	</etcitem>
	<etcitem id="91016" name="Sword of Ipos Ingredient/Recipe Box">
		<set name="sellable" value="false"/>
		<set name="dropable" value="false"/>
		<set name="icon" value="icon.etc_treasure_box_i04"/>
		<set name="stackable" value="true"/>
		<set name="crystal_type" value="NONE"/>
	</etcitem>
	<etcitem id="91017" name="Barakiel\'s Axe Ingredient/Recipe Box">
		<set name="sellable" value="false"/>
		<set name="dropable" value="false"/>
		<set name="icon" value="icon.etc_treasure_box_i04"/>
		<set name="stackable" value="true"/>
		<set name="crystal_type" value="NONE"/>
	</etcitem>
	<etcitem id="91018" name="Behemoth\' Tuning Fork Ingredient/Recipe Box">
		<set name="sellable" value="false"/>
		<set name="dropable" value="false"/>
		<set name="icon" value="icon.etc_treasure_box_i04"/>
		<set name="stackable" value="true"/>
		<set name="crystal_type" value="NONE"/>
	</etcitem>
	<etcitem id="91019" name="Naga Storm Ingredient/Recipe Box">
		<set name="sellable" value="false"/>
		<set name="dropable" value="false"/>
		<set name="icon" value="icon.etc_treasure_box_i04"/>
		<set name="stackable" value="true"/>
		<set name="crystal_type" value="NONE"/>
	</etcitem>
	<etcitem id="91020" name="Tiphon\'s Spear Ingredient/Recipe Box">
		<set name="sellable" value="false"/>
		<set name="dropable" value="false"/>
		<set name="icon" value="icon.etc_treasure_box_i04"/>
		<set name="stackable" value="true"/>
		<set name="crystal_type" value="NONE"/>
	</etcitem>
	<etcitem id="91021" name="Shyeed\'s Bow Ingredient/Recipe Box">
		<set name="sellable" value="false"/>
		<set name="dropable" value="false"/>
		<set name="icon" value="icon.etc_treasure_box_i04"/>
		<set name="stackable" value="true"/>
		<set name="crystal_type" value="NONE"/>
	</etcitem>
	<etcitem id="91022" name="Sobekk\'s Hurricane Ingredient/Recipe Box">
		<set name="sellable" value="false"/>
		<set name="dropable" value="false"/>
		<set name="icon" value="icon.etc_treasure_box_i04"/>
		<set name="stackable" value="true"/>
		<set name="crystal_type" value="NONE"/>
	</etcitem>
	<etcitem id="91023" name="Themis\' Tongue Ingredient/Recipe Box">
		<set name="sellable" value="false"/>
		<set name="dropable" value="false"/>
		<set name="icon" value="icon.etc_treasure_box_i04"/>
		<set name="stackable" value="true"/>
		<set name="crystal_type" value="NONE"/>
	</etcitem>
	<etcitem id="91024" name="Cabrio\'s Hand Ingredient/Recipe Box">
		<set name="sellable" value="false"/>
		<set name="dropable" value="false"/>
		<set name="icon" value="icon.etc_treasure_box_i04"/>
		<set name="stackable" value="true"/>
		<set name="crystal_type" value="NONE"/>
	</etcitem>
	<etcitem id="91025" name="Daimon Crystal Ingredient/Recipe Box">
		<set name="sellable" value="false"/>
		<set name="dropable" value="false"/>
		<set name="icon" value="icon.etc_treasure_box_i04"/>
		<set name="stackable" value="true"/>
		<set name="crystal_type" value="NONE"/>
	</etcitem>
	<etcitem id="91026" name="Dragon\'s Heart">
		<set name="sellable" value="false"/>
		<set name="dropable" value="false"/>
		<set name="icon" value="icon.etc_heart_gragon"/>
		<set name="stackable" value="true"/>
		<set name="crystal_type" value="NONE"/>
	</etcitem>
	<etcitem id="91027" name="Dragon\'s Miracle Potion">
		<set name="sellable" value="false"/>
		<set name="dropable" value="false"/>
		<set name="icon" value="icon.bm_dragon_posion_brave"/>
		<set name="stackable" value="true"/>
		<set name="crystal_type" value="NONE"/>
	</etcitem>
	<etcitem id="91028" name="Dragon\'s Recovery Potion" add_name="Not Available">
		<set name="sellable" value="false"/>
		<set name="dropable" value="false"/>
		<set name="icon" value="BranchSys.icon.br_vitality_potion_i01"/>
		<set name="stackable" value="true"/>
		<set name="crystal_type" value="NONE"/>
	</etcitem>
</list>