<?xml version="1.0" encoding="UTF-8"?>
<!DOCTYPE list SYSTEM "item.dtd">
<list>
	<weapon id="37700" name="Valentine Dual Dagger ">
		<set name="sellable" value="false"/>
		<set name="privatestoreable" value="false"/>
		<set name="dropable" value="false"/>
		<set name="tradeable" value="false"/>
		<set name="crystal_type" value="NONE"/>
		<set name="icon" value="icon.ev_hallowinday_candy_i00"/>
		<set name="type" value="DUALDAGGER"/>
		<set name="weight" value="500"/>
		<set name="soulshots" value="1"/>
		<set name="spiritshots" value="1"/>
		<set name="rnd_dam" value="10"/>
		<equip>
			<slot id="LEFT_RIGHT_HAND"/>
		</equip>
		<for>
			<add stat="pAtk" order="0x10" value="752"/>
			<add stat="mAtk" order="0x10" value="414"/>
			<set stat="basePAtkSpd" order="0x08" value="433"/>
			<set stat="basePCritRate" order="0x08" value="120"/>
			<add stat="pAccCombat" order="0x10" value="-3.75"/>
		</for>
	</weapon>
	<weapon id="37701" name="Valentine Dual Blunt Weapon ">
		<set name="sellable" value="false"/>
		<set name="privatestoreable" value="false"/>
		<set name="dropable" value="false"/>
		<set name="tradeable" value="false"/>
		<set name="crystal_type" value="NONE"/>
		<set name="icon" value="icon.ev_hallowinday_candy_i00"/>
		<set name="type" value="DUALBLUNT"/>
		<set name="weight" value="500"/>
		<set name="soulshots" value="1"/>
		<set name="spiritshots" value="1"/>
		<set name="rnd_dam" value="20"/>
		<equip>
			<slot id="LEFT_RIGHT_HAND"/>
		</equip>
		<for>
			<add stat="pAtk" order="0x10" value="916"/>
			<add stat="mAtk" order="0x10" value="414"/>
			<set stat="basePAtkSpd" order="0x08" value="325"/>
			<set stat="basePCritRate" order="0x08" value="60"/>
			<add stat="pAccCombat" order="0x10" value="8"/>
		</for>
	</weapon>
	<weapon id="37702" name="Valentine Shield">
		<set name="sellable" value="false"/>
		<set name="privatestoreable" value="false"/>
		<set name="dropable" value="false"/>
		<set name="tradeable" value="false"/>
		<set name="crystal_type" value="NONE"/>
		<set name="icon" value="icon.ev_hallowinday_candy_i00"/>
		<set name="type" value="NONE"/>
		<set name="weight" value="1130"/>
		<equip>
			<slot id="LEFT_HAND"/>
		</equip>
		<for>
			<add stat="pEvasRate" order="0x10" value="-8"/>
			<add stat="sDef" order="0x10" value="546"/>
			<add stat="rShld" order="0x10" value="20"/>
		</for>
	</weapon>
	<armor id="37703" name="Valentine Sigil ">
		<set name="sellable" value="false"/>
		<set name="privatestoreable" value="false"/>
		<set name="dropable" value="false"/>
		<set name="tradeable" value="false"/>
		<set name="crystal_type" value="NONE"/>
		<set name="icon" value="icon.ev_hallowinday_candy_i00"/>
		<set name="type" value="SIGIL"/>
		<set name="weight" value="920"/>
		<equip>
			<slot id="LEFT_HAND"/>
		</equip>
		<for>
			<add stat="pDef" order="0x10" value="150"/>
		</for>
	</armor>
	<etcitem id="37704" name="Love Potion">
		<set name="icon" value="icon.etc_whiteday_herb"/>
		<set name="crystal_type" value="NONE"/>
	</etcitem>
	<etcitem id="37705" name="Gold Fishing Shot">
		<set name="price" value="56"/>
		<set name="sellable" value="false"/>
		<set name="icon" value="icon.etc_spirit_bullet_fish_i05"/>
		<set name="weight" value="3"/>
		<set name="stackable" value="true"/>
		<set name="crystal_type" value="NONE"/>
		<set name="type" value="FISHSHOT"/>
		<skills>
			<skill id="55326" level="1"/>	<!--Gold Fishing Shot-->
		</skills>
	</etcitem>
	<armor id="37725" name="NC Dinos Uniform">
		<set name="sellable" value="false"/>
		<set name="privatestoreable" value="false"/>
		<set name="dropable" value="false"/>
		<set name="tradeable" value="false"/>
		<set name="crystal_type" value="NONE"/>
		<set name="icon" value="icon.london_olympic_bikini"/>
		<set name="type" value="HEAVY"/>
		<set name="weight" value="1000"/>
		<equip>
			<slot id="FORMAL_WEAR"/>
		</equip>
	</armor>
	<armor id="37726" name="NC Dinos Shortstop Cap">
		<set name="sellable" value="false"/>
		<set name="privatestoreable" value="false"/>
		<set name="destroyable" value="false"/>
		<set name="dropable" value="false"/>
		<set name="tradeable" value="false"/>
		<set name="crystal_type" value="NONE"/>
		<set name="icon" value="icon.accessory_mining_cap_i00"/>
		<set name="type" value="NONE"/>
		<equip>
			<slot id="HAIR_ALL"/>
		</equip>
	</armor>
</list>